name,price,description,link_image
Bàn Cào Móng Cong Lượn Sóng (Bcm),60.000₫,"THÔNG TIN CHI TIẾT
 Xuất xứ  Trung Quốc
 Chất liệu  Carton
 Trọng lượng  300g
 HDSD  Sản phẩm dùng để thư giãn cho mèo
 Kích thước  44*21.5*4cm
 Lưu ý  Để ở nơi khô ráo, thoáng mát
 Quy cách
 - 1 bàn cào 44*21.5*4cm
 - 1 gói catnip tặng kèm
MÔ TẢ SẢN PHẨM
Bàn cào móng cong lượn sóng giúp mèo vui chơi và thư giãn, giúp móng luôn sạch sẽ và bớt sắc nhọn.
Bàn cào móng cong lượn sóng
- Giúp móng mèo luôn trong hiện trạng thấp nhất.
- Được làm bằng chất liệu carton, thân thiện với môi trường
- Có thể dịch chuyển dễ dàng, tránh vướng víu và tốn diện tích trong nhà
- Giúp bảo vệ đồ sử dụng trong nhà không bị mèo cào theo thói quen.
Bàn cào móng cong lượn sóng có tặng kèm catnip để mèo thoải mái thư giãn. Sản phẩm có kích cỡ : 44*21.5*4cm.
#dochoichomeo #meo #bancaomong #carton #Kunmiupetshop
Bàn cào móng cong lượn sóng
 ",https://bizweb.dktcdn.net/100/229/172/products/ban-cao-mong-cong-5-jpeg.jpg?v=1616686921123
Đồ Chơi Bóng Chuông Nhựa Cho Mèo (Màu Ngẫu Nhiên) (Bcn),5.000₫,"Đồ chơi bóng chuông nhựa cho mèo là 1 loại đồ chơi cho mèo hình bóng có 1 quả chuông bên trong, giúp thú cưng giảm stress hiệu quả..
- Đồ chơi bóng chuông nhựa giúp gia tăng nhanh nhẹn, hoạt bát cho mèo.
- Sản phẩm Đồ chơi bóng chuông nhựa cho mèo được bán tại Kún Miu pet shop",https://bizweb.dktcdn.net/100/229/172/products/do-choi-bong-chuong-cho-meo.jpg?v=1552128612893
Đồ Chơi Cho Chó Gặm Hình Quả Bóng Diil HS057,30.000₫,"Đồ chơi cho chó gặm hình quả bóng Diil HS057 là đồ chơi sắc màu vui nhộn được làm bằng chất liệu cao su thiên nhiên cao cấp, ko có chất độc hại, an toàn với người và vật nuôi..
Đồ chơi cho chó gặm hình quả bóng Diil HS057 giúp cho thú cưng không còn nhai hoặc cắn các vật dụng trong nhà. 
Trên sản phẩm có gai và đường viền gân sẽ giúp làm sạch răng cho chó khi gặm và nhai, ngoài ra cấu tạo hình bóng sẽ giúp chó mèo vận động tích cực hơn.
Đồ chơi cho chó gặm hình quả bóng Diil HS057 còn phát ra âm thanh bíp bíp kích thích thính giác và sự tò mò, thích thú cho chú chó của bạn.
Sản phẩm có đường kính 6cm
Trọng lượng 100g",https://bizweb.dktcdn.net/100/229/172/products/bong-do-choi-dill-1.jpg?v=1560069307290
Trụ Cào Móng Cho Mèo Đế Tròn,180.000₫,"Trụ cào móng cho mèo đế tròn là sản phẩm được ưa chuộng nhất. Chất liệu tự nhiên, bền tốt không bị trầy xước, giúp móng mèo luôn chắc khỏe..
- Mèo cào móng để đánh dấu lãnh thổ của nó và giúp gỡ bỏ lớp móng cũ, ngoài ra đó cũng là một hình thức tập thể dục, tận hưởng khoảng thời gian thoải mái và thư giãn một cách đơn giản nhất.
Trụ cào móng cho mèo đế tròn đơn giản, dễ sử dụng, giá thành hợp lý và chất lượng cao
Kích cỡ 40*25cm",https://bizweb.dktcdn.net/100/229/172/products/tru-cao-mong-de-tron-a-4.jpg?v=1581092997427
Cần Câu Sắt Cho Mèo Có Lông Và Chuông,30.000₫,"Cần câu sắt cho mèo có lông và chuông ngộ nghĩnh, dễ thương, với chú cá giả, chuột giả hoặc lông vũ buộc vào cần câu bằng dây sắt, bạn sẽ tha hồ đùa giỡn với chú mèo của mình.
+Cần câu sắt cho mèo có lông và chuôngDùng để chơi đùa cùng thú cưng của bạn.
+ Đủ màu sắc ngộ nghĩnh đáng yêu, thu hút thú cưng nhà bạn chơi đùa cùng Cần câu mèo, tăng cương khả năng vận động hoạt bát của thú cưng.
+ Chi tiết: 1 cần + 1 hình thú, kích thích thú cưng vờn bắt.
+ Mầu sắc : như hình
+ Cần câu mèo đồ chơi cho thú cưng, kiểu dáng và màu sắc đẹp, hấp dẫn thú cưng nhà bạn, chất liệu bền, chắc chắn
- Sản phẩm Cần câu sắt cho mèo có lông và chuông được bán tại Kún Miu pet shop",https://bizweb.dktcdn.net/100/229/172/products/o1cn011zhije24vh8poky-3963416746.jpg?v=1552240842627
Đồ Chơi Chút Chít Cho Chó Hình Hoa Quả - Cà Tím,30.000₫,"Đồ chơi chút chít cho chó hình hoa quả hình hoa quả là đồ chơi sắc màu vui nhộn và tạo ra âm thanh bíp bip cho vật nuôi nhà bạn vui chơi..
+ Làm từ chất liệu an toàn, màu sắc thu hút, giúp thú cưng hăng say chơi chúng, tạo sự vận động khỏe mạnh và nhanh nhẹnz
+ Sản phẩm Đồ chơi chút chít cho chó hình hoa quả có Thiết kế các hình thù ngộ nghĩnh  giúp thú cưng dễ vờn nghịch mà ko sợ trơn tuột mất.
+ Đồ chơi cho chó kiểu dáng và màu sắc đẹp, hấp dẫn thú cưng nhà bạn, chất liệu bền, chắc chắn, bán rẻ nhất tại Kún Miu
Loại: Đồ chơi
- Sản phẩm Đồ chơi chút chít cho chó hình hoa quả được bán tại hệ thống Kún Miu pet shop",https://bizweb.dktcdn.net/100/229/172/products/do-choi-chut-chit-hoa-qua-3.jpg?v=1568215804263
Đồ Chơi Bọ Rùa Máy Cho Mèo,20.000₫,"Đồ chơi Bọ rùa máy cho mèo là đồ chơi phù hợp với những chú mèo nghịch ngợm, thích tò mò. Mèo sẽ rất thích những vật nhỏ xinh, nhất là những vật chuyển động giúp mèo rất thích thú..
Đồ chơi bọ rùa máy cho mèo giúp thú cưng của bạn trở nên linh hoạt. Sản phẩm được thiết kế với chất liệu nhựa bền để những chú mèo đùa nghịch, vận động nhiều hơn.
Đồ chơi bọ rùa máy cho mèo chạy pin giúp dễ dàng thay thế.
- Kích thước: 4.5*1.5*1.5cm.",https://bizweb.dktcdn.net/100/229/172/products/do-choi-bo-dien-tu-4-1.jpg?v=1588082761903
"Bóng Đồ Chơi Chút Chít Hình Bàn Chân, Mặt Chó",25.000₫,"Bóng đồ chơi chút chít hình bàn chân, mặt chó là đồ chơi có màu sắc sặc sỡ, bắt mắt, rất được ưa chuộng trên thị trường hiện nay..
Bóng đồ chơi chút chít hình bàn chân, mặt chó được làm từ chất liệu nhựa dẻo an toàn. Khi cún nhà bạn chơi đùa sẽ tạo ra tiếng kêu chút chít rất vui tai. Thiết kế hình quả bóng sẽ giúp Boss dễ ngậm và gặm mà không gây đau đớn hay bất tiện.
Bóng đồ chơi chút chít hình bàn chân, mặt chó sẽ giúp kích thích khả năng vận động cho chó, giúp chúng thư giản và luôn thoải mái. Bạn cũng có thể chơi đùa với chúng bằng cách ném bóng để tăng tình cảm và có thêm thời gian vui đùa cùng chúng. 
Sản phẩm sẽ giúp hạn chế việc cắn đồ đạc trong nhà như dép, gối,... của chó nhà bạn. Vậy thì còn chần chờ gì nữa mà không thêm ngay Bóng đồ chơi chút chít hình bàn chân, mặt chó  vào giỏ hàng nào?
Sản phẩm có đường kính 7cm.",https://bizweb.dktcdn.net/100/229/172/products/bong.jpg?v=1599229040063
Catnip Gắn Tường Cho Mèo,35.000₫,"THÔNG TIN CHI TIẾT
 Sản phẩm  Catnip gắn tường cho mèo
 Công dụng
 - Giúp mèo vui vẻ, thích thú giảm căng thẳng
 - Kích thích vị giác, giúp mèo ăn uống ngon miệng hơn
 - Bổ sung nhiều taurine và chất dinh dưỡng khác giúp mắt mèo sáng hơn
 - Nuôi dưỡng bộ lông bóng mượt.
 Trọng lượng  50g 
 Đóng gói  Mèo catnip và miếng dán
MÔ TẢ SẢN PHẨM
Catnip gắn tường cho mèo là sản phẩm thông minh với hình mèo ngộ nghĩnh cùng viên catnip chất lượng giúp chúng thư giãn và có những phút giây thoải mái nhất.
Catnip gắn tường cho mèo rất tiện lợi, bạn có thể gắn ở chân bàn, ghê hay chân giường để mèo tự cọ mặt, thân vào viên catnip và tự mát xa. Được thưởng thức catnip và chà xát ngứa là sở thích lớn nhất của mèo, vậy nên sản phẩm này sẽ là sự lựa chọn số 1 cho các Boss.
Catnip gắn tường cho mèo có công dụng:
- Giúp mèo vui vẻ, thích thú giảm căng thẳng
- Kích thích vị giác, giúp mèo ăn uống ngon miệng hơn
- Bổ sung nhiều taurine và chất dinh dưỡng khác giúp mắt mèo sáng hơn
- Nuôi dưỡng bộ lông bóng mượt.
Trọng lượng: 50g
 ",https://bizweb.dktcdn.net/100/229/172/products/catnip-da-n-tu-o-ng-be-n-trong.jpg?v=1659586560377
Đồ Chơi Cho Mèo Hình Mặt Cầu Và Bóng Diil HS068,70.000₫,"Đồ chơi cho mèo hình mặt cầu và bóng - Diil HS068 là đồ chơi cho mèo có hình mặt cầu như 1 chiếc đĩa bay, bên trong đó là 1 quả bóng có chuông phát ra âm thanh, kích thích mèo vận động.
Đồ chơi cho mèo hình mặt cầu và bóng làm từ chất liệu nhựa an toàn cho người và vật nuôi.
Kiểu dáng và màu sắc đẹp, hấp dẫn thú cưng nhà bạn,
Kích thước : 26*9cm
Trọng lượng : 300g
   ",https://bizweb.dktcdn.net/100/229/172/products/do-choi-cho-meo-mat-cau-bong-1.jpg?v=1560008680520
Đồ Chơi Cho Chó Gặm Hình Xương Cá Diil HS039,30.000₫,"Đồ chơi cho chó gặm hình xương cá Diil HS039 là đồ chơi sắc màu vui nhộn được làm bằng chất liệu cao su thiên nhiên cao cấp, ko có chất độc hại, an toàn với người và vật nuôi..
+ Đồ chơi cho chó gặm hình xương cá Diil HS039 giúp cho thú cưng không còn nhai hoặc cắn các vật dụng trong nhà. 
Sản phẩm còn giúp răng miệng các bé chắc khoẻ, thiết kế dạng hình xương cá có những khe hở giúp làm sạch răng khi gặm
Sản phẩm có chiều dài 12 đến 12.5cm
Trọng lượng 100g
 ",https://bizweb.dktcdn.net/100/229/172/products/do-choi-xuong-ca-diil-1.jpg?v=1560069090760
Đồ Chơi Quả Tạ Gai Có Chuông,30.000₫,"Đồ chơi cho chó hình quả tạ gai có chuông là loại đồ chơi hình xương có gai, chắc chắn giúp thú cưng dễ vui chơi, vờn nghịch mà ko sợ trơn tuột mất..
+ Đồ chơi cho chó hình quả tạ gai có chuông làm từ chất liệu an toàn, màu sắc thu hút, giúp thú cưng hăng say chơi chúng, tạo sự vận động khỏe mạnh và nhanh nhẹn
+ Kiểu dáng và màu sắc đẹp, hấp dẫn thú cưng nhà bạn, chất liệu bền, chắc chắn
Chất liệu: Cao su
Sản phẩm có chiều dài 14cm, độ dày là 4.5cm
Lưu ý: Quý khách vui lòng ghi chú màu sắc mong muốn. Chúng tôi sẽ gửi màu ngẫu nhiên nếu như đơn hàng không có ghi chú hoặc màu sắc quý khách muốn",https://bizweb.dktcdn.net/100/229/172/products/qua-ta-gai-co-chuong-2.jpg?v=1589642008133
Đồ Chơi Dây Thừng Cho Chó,10.000₫ 25.000₫,"THÔNG TIN CHI TIẾT
 Thương hiệu  Kún Miu
 Chất liệu  Vải sợi chỉ to
 HDSD  Đồ chơi cho chó
 Kích thước  15cm và 25cm
 Quy cách   1 đồ chơi dây thừng
MÔ TẢ SẢN PHẨM
Đồ chơi dây thừng cho chó là sản phẩm được làm từ dây thừng chắc chắn với nhiều màu sắc sặc sỡ, thu hút mọi sự chú ý của cún..
Chắc hẳn bạn rất đau đầu vì thói quen cắn phá đồ của cún nhà mình. Bạn mệt mỏi vì hằng ngày phải nhìn thấy giày dép của mình bị cún cắn nát hay đồ đạc bị chúng phá hỏng. Đồ chơi dây thừng cho chó sẽ giúp bạn giải quyết chuyện này.
Đồ chơi dây thừng cho chó vừa giúp bạn khỏi đau đầu, vừa giúp cho cún được xả stress. Đồ chơi giúp kích thích khả năng vận động và giải trí cho chó. Bạn cũng có thể dành thời gian để chơi đùa cùng chúng bằng cách ném Đồ chơi dây thừng cho chó và để chúng nhặt lại. Từ đó cả 2 sẽ có khoảng thời gian vui vẻ với nhau và tạo nên thật nhiều kỉ niệm.
Kích thước: 15cm và 25cm.
 ",https://bizweb.dktcdn.net/100/229/172/products/do-choi-cho-cho-day-thung-25cm.png?v=1598544864393
Bóng Có Lông Catnip Cho Mèo,15.000₫,"Sản phẩm Bóng có lông catnip cho mèo là 1 loại đồ chơi cho mèo có hình cầu được bọc bông và gắn lông rất bắt mắt, sản phẩm có được tẩm catnip để kích thích hưng phấn cho mèo, giúp mèo vận động, vui chơi  hoạt bát hơn và giúp mèo khạc lông khi chúng thường xuyên liếm lông trên cơ thể..
Bóng có lông catnip cho mèo giúp mèo chơi thích thú vì có catnip khiến mèo điên đảo
Còn gì thú vị hơn khi ngắm nhìn chú mèo của bạn vừa chơi đùa vừa hít vừa phê..",https://bizweb.dktcdn.net/100/229/172/products/bong-catnip-2.jpg?v=1551287893703
Kính Thời Trang Cho Chó,55.000₫,"Cũng giống như con người, những người bạn bốn chân của chúng ta cũng có nhu cầu mặc quần áo và bảo vệ cơ thể mỗi khi ra ngoài. Và mắt kính, kính mát là một trong những phụ kiện bảo vệ quan trọng đối với các bé..
Kính thời trang cho chó giúp bảo vệ mắt các bé trước tia cực tím và những tia có hại, khói bụi và mảnh vỡ, ngoài ra, kính mát còn có tác dụng cải thiện tầm nhìn xa. Bên cạnh những lý do trên thì lý do về thời trang cũng góp phần quan trọng không kém.
Được làm bằng chất liệu nhựa dẻo an toàn, không gây hại cho các bé
Kính thời trang cho chó có cấu tạo khớp dẻo, dễ dàng gấp đôi lại
Dây đeo đàn hồi thích hợp với hầu hết các bé 
Mặt kính trong suốt, bền, thời gian sử dụng lâu
 ",https://bizweb.dktcdn.net/100/229/172/products/kinh-cho-cho-1.jpg?v=1558620802817
Đồ Chơi Ống Cào Móng Có Bóng Cho Mèo,70.000₫,"THÔNG TIN CHI TIẾT
 Tên sản phẩm  Đồ chơi ống cào móng có bóng cho mèo
 Chất liệu  Sợi sisal, cói + bóng nhựa
 HDSD  Cho mèo chơi đùa, cào móng
 Trọng lượng  200g
 Kích thước  29*7.5cm
MÔ TẢ SẢN PHẨM
Đồ chơi ống cào móng có bóng cho mèo được làm từ các sợi dây gai dầu sisal chất lượng đem lại cảm giác thích thú cho mèo khi cào móng.
Đồ chơi ống cào móng có bóng cho mèo không những là đồ chơi mà còn là một vật hữu ích giúp chú mèo mài móng rất hiệu quả. Thú cưng sẽ rất thích những quả bóng nhựa di chuyển bên trong mỗi khi chơi đùa. Việc này sẽ điều kiện rèn luyện thể chất cũng như não bộ và bắt chước hành vi tự nhiên của mèo cưng.
Đồ chơi ống cào móng có bóng cho mèo còn niềm vui tiếng cười cho những người xung quanh khi thấy mèo cưng đùa nghịch thật dễ thương và vui vẻ.
Kích thước: 29*7.5cm
#dochoichomeo #ongcaomong #kunmiupetshop
 ",https://bizweb.dktcdn.net/100/229/172/products/do-choi-ong-cao-mong-co-bong-2.jpg?v=1573190079017
Đồ Chơi Cho Mèo Catch The Mouse Motion -Diil HS065,80.000₫,"Đồ chơi cho mèo Catch The Mouse Motion là loại đồ chơi được làm từ chất liệu cao cấp an toàn cho người và vật nuôi..
Cấu tạo của Đồ chơi cho mèo Catch The Mouse Motion bao gồm 1 hình hộp nhựa trụ dẹt, bên trong có gắp 1 chú chuột lông có thể quay quanh trục giữa.
Đồ chơi cho mèo Catch The Mouse Motion giúp mèo vận động, kích thích sự hưng phấn khi chơi đùa, giúp mèo giảm stress.
Sản phẩm có kích thước: 25*7cm
Trọng lượng : 250g",https://bizweb.dktcdn.net/100/229/172/products/do-choi-catch-the-mouse-1.jpg?v=1560009514307
Đồ Chơi Xương Gai Cong Chữ S Cho Chó,30.000₫,"Đồ chơi cho chó hình xương gai chữ S là loại đồ chơi hình xương có gai, chắc chắn giúp thú cưng dễ vui chơi, vờn nghịch mà ko sợ trơn tuột mất..
+ Đồ chơi cho chó cỡ nhỏ Làm từ chất liệu an toàn, màu sắc thu hút, giúp thú cưng hăng say chơi chúng, tạo sự vận động khỏe mạnh và nhanh nhẹn
+ Kiểu dáng và màu sắc đẹp, hấp dẫn thú cưng nhà bạn, chất liệu bền, chắc chắn
Chất liệu: Cao su
Sản phẩm có chiều dài 16 cm, độ dày là 3 cm
Lưu ý: Quý khách vui lòng ghi chú màu sắc mong muốn. Chúng tôi sẽ gửi màu ngẫu nhiên nếu như đơn hàng không có ghi chú hoặc màu sắc quý khách muốn",https://bizweb.dktcdn.net/100/229/172/products/xuong-cong-gai-5.jpg?v=1589642303037
Đồ Chơi Dây Thừng Bóng Cao Su Cho Chó,35.000₫,"*Đồ chơi dây thừng bóng cao su cho chó Kún Miu có ưu điểm:
- Chất liệu cao su tự nhiên, an toàn sức khỏe.
- Bề mặt bóng có độ ma sát, không trơn trượt..
- Thú cưng vừa chơi đùa vừa có thể gặm bóng để làm sạch răng.
- Bóng cao su cho chó mèo có kích cỡ đa dạng, phù hợp với nhiều loại chó mèo.
- Màu sắc bắt mắt gây sự chú ý và thích thú.
- Thường sử dụng làm bóng huấn luyện chó mèo.
  *THÔNG SỐ KỸ THUẬT Đồ chơi dây thừng bóng cao su cho chó :
-Bóng cao su cho chó Size M (5cm), kèm dây
-Bóng cao su cho chó Size L (7cm), kèm dây
-Bóng cao su cho chó Size XL (8.6cm), kèm dây
-Chất liệu Cao su thiên nhiên
-Kích thước bóng 5cm, 6cm, 7cm, 8.6cm
-Kích thước dây 42, 32cm, 37cm
-Khối lượng 94g, 145g, 208g, 370g",https://bizweb.dktcdn.net/100/229/172/products/nen-anh-bong-day.jpg?v=1552327344003
Đồ Chơi Bóng Cói Lông Vũ Cho Mèo,15.000₫,"THÔNG TIN CHI TIẾT
 Thương hiệu  Kún Miu
 Chất liệu  Cói
 Trọng lượng  15g
 Quy cách   1 quả bóng cói lông vũ
MÔ TẢ SẢN PHẨM
Đồ chơi bóng cói lông vũ cho mèo được làm từ các sợi dây gai dầu từ tự nhiên, được đan và gắn lại tạo nên quả bóng cói cho mèo. Ở giữa quả bóng chính là lông vũ siêu mềm thu hút sự chú ý và thích thú của mèo.
Đồ chơi bóng cói lông vũ cho mèo tạo điều kiện rèn luyện thể chất cũng như não bộ khi đuổi bắt và đá bóng. Sản phẩm còn giúp mèo mài móng rất hiệu quả, làm giảm bớt sự sắc nhọn cho vuốt mèo.
Đồ chơi bóng cói lông vũ cho mèo sẽ tạo niềm cho thú cưng và người chủ, bạn sẽ có thật nhiều kỉ niệm khi chơi đùa cùng mèo.
Sản phẩm có trọng lượng 15gr.
#dochoichomeo #bong #kunmiu #kúnmiu
 ",https://bizweb.dktcdn.net/100/229/172/products/bo-ng-co-i-lo-ng-vu.jpg?v=1617810984917
Ổ Cào Móng Hình Tròn Cho Mèo,55.000₫,"THÔNG TIN CHI TIẾT
 Sản phẩm  Ổ cào móng hình tròn cho mèo
 Công dụng
   - Xả stress cho các boss mỗi ngày
 - Giúp mèo giải trí bớt nhàm chán khi ở nhà một mình 
 - Giúp bảo vệ và mài mòn móng, giảm độ sắc nhọn 
 Trọng lượng   300g
 Chất liệu  Carton cao cấp
MÔ TẢ SẢN PHẨM
Ổ cào móng hình tròn cho mèo là trợ thủ đắc lực giúp mèo cào móng xả stress và hạn chế chúng cào đồ vật trong nhà như ghế sofa, dép,...
Ổ cào móng hình tròn cho mèo làm bằng carton, mềm mại và an toàn không sợ Boss bị tổn thương. Đây đảm bảo sẽ là đồ vật hữu dụng trong nhà cho các boss! Bạn có thể rắc catnip vào ổ cào móng, sau đó nâng cao bàn chân trước của mèo vào cào để chúng quen dần.
Ổ cào móng hình tròn cho mèo có ông dụng:
- Xả stress cho các boss mỗi ngày
- Giúp mèo giải trí bớt nhàm chán khi ở nhà một mình 
- Giúp bảo vệ và mài mòn móng, giảm độ sắc nhọn 
Hình dáng: Hình tròn
Trọng lượng: 300g
 ",https://bizweb.dktcdn.net/100/229/172/products/o-ca-o-mo-ng-hi-nh-tro-n-cho-me-o.jpg?v=1683875295747
Chuông Huấn Luyện Chó Mèo,40.000₫,"Chuông huấn luyện chó mèo kì diệu sẽ giúp bạn rèn luyện thói quen giờ giấc cho thú cưng. Mỗi lần bạn cho bé thì bạn bấm chuông và làm hành động lặp đi lặp lại sẽ tạo thành một phản xạ có điều kiện rồi khi nghe thấy chuông chúng sẽ biết để thực hiện như một thói quen.
Làm cách nào để có thể huấn luyện thú cưng sử dụng Chuông huấn luyện chó mèo:
- Đầu tiên hay để tay các bé lên chiếc chuông để tạo ra tiếng động.
- Tập cho thú cưng làm hành động mà bạn muốn như: đứng lên, ngồi xuống,...
- Tặng một món thưởng nào đó mà bé cực thích, cứ liên tục như thế lâu dần sẽ tạo cho các bé phản xạ có điều kiện và sẽ luôn nghe lời khi bấm chuông.
Chuông huấn luyện chó mèo được làm từ thép không gỉ, có chân nhựa bao quanh cùng thiết kế bắt mắt chắc chắn sẽ khiến bạn bị thu hút.
Kích cỡ sản phẩm: 7.2*5cm.",https://bizweb.dktcdn.net/100/229/172/products/chuong-huan-luyen-2.jpg?v=1572975014680
Kính Thời Trang Cho Mèo,35.000₫,"Cũng giống như con người, những người bạn bốn chân của chúng ta cũng có nhu cầu mặc quần áo và bảo vệ cơ thể mỗi khi ra ngoài. Và mắt kính, kính mát là một trong những phụ kiện bảo vệ quan trọng đối với các bé..
Kính mát giúp bảo vệ mắt các bé trước tia cực tím và những tia có hại, khói bụi và mảnh vỡ, ngoài ra, kính mát còn có tác dụng cải thiện tầm nhìn xa. Bên cạnh những lý do trên thì lý do về thời trang cũng góp phần quan trọng không kém.
Được làm bằng chất liệu nhựa dẻo an toàn, không gây hại cho các bé
Kính thời trang cho mèo có cấu tạo khớp dẻo, dễ dàng gấp đôi lại
Dây đeo đàn hồi thích hợp với hầu hết các bé 
Mặt kính trong suốt, bền, thời gian sử dụng lâu
Kính thời trang cho mèo
Chiều rộng : 8.5 cm
 ",https://bizweb.dktcdn.net/100/229/172/products/kinh-cho-meo-4.jpg?v=1552285229980
Đồ Chơi Chút Chít Cho Chó Hình Đôi Môi,25.000₫,"- Đồ chơi chút chít cho chó hình đôi môi có nhiều màu sắc, là đồ chơi tiện lợi an toàn, phát ra âm thanh hấp dẫn, giúp cho thú cưng nhai cắn để không cắn đồ của nhà như giầy dép…..
- Đồ chơi chút chít cho chó hình đôi môi Tăng cường khả năng vận động hoạt bát của thú cưng. 
- Chất liệu nhựa dẻo mềm, sờ êm, gây kích thích và hưng phấn cho chó mèo tham gia hoạt động và an toàn cho người, thú cưng.
Kích cỡ: 9*8cm",https://bizweb.dktcdn.net/100/229/172/products/do-choi-hinh-moi-2.jpg?v=1572973682090
